{
 "nelx": 40,
 "nely": 20,
 "nelz": 5,
 "volfrac": 0.45,
 "element_size_mm": 4.0,
 "material_name": "nhom_6061_t6",
 "supports": [
  {
   "x": 4,
   "y": 9,
   "z": 0,
   "dof": "all"
  },
  {
   "x": 4,
   "y": 9,
   "z": 1,
   "dof": "all"
  },
  {
   "x": 4,
   "y": 9,
   "z": 2,
   "dof": "all"
  },
  {
   "x": 4,
   "y": 9,
   "z": 3,
   "dof": "all"
  },
  {
   "x": 4,
   "y": 9,
   "z": 4,
   "dof": "all"
  },
  {
   "x": 4,
   "y": 9,
   "z": 5,
   "dof": "all"
  },
  {
   "x": 4,
   "y": 10,
   "z": 0,
   "dof": "all"
  },
  {
   "x": 4,
   "y": 10,
   "z": 1,
   "dof": "all"
  },
  {
   "x": 4,
   "y": 10,
   "z": 2,
   "dof": "all"
  },
  {
   "x": 4,
   "y": 10,
   "z": 3,
   "dof": "all"
  },
  {
   "x": 4,
   "y": 10,
   "z": 4,
   "dof": "all"
  },
  {
   "x": 4,
   "y": 10,
   "z": 5,
   "dof": "all"
  },
  {
   "x": 4,
   "y": 11,
   "z": 0,
   "dof": "all"
  },
  {
   "x": 4,
   "y": 11,
   "z": 1,
   "dof": "all"
  },
  {
   "x": 4,
   "y": 11,
   "z": 2,
   "dof": "all"
  },
  {
   "x": 4,
   "y": 11,
   "z": 3,
   "dof": "all"
  },
  {
   "x": 4,
   "y": 11,
   "z": 4,
   "dof": "all"
  },
  {
   "x": 4,
   "y": 11,
   "z": 5,
   "dof": "all"
  },
  {
   "x": 5,
   "y": 9,
   "z": 0,
   "dof": "all"
  },
  {
   "x": 5,
   "y": 9,
   "z": 1,
   "dof": "all"
  },
  {
   "x": 5,
   "y": 9,
   "z": 2,
   "dof": "all"
  },
  {
   "x": 5,
   "y": 9,
   "z": 3,
   "dof": "all"
  },
  {
   "x": 5,
   "y": 9,
   "z": 4,
   "dof": "all"
  },
  {
   "x": 5,
   "y": 9,
   "z": 5,
   "dof": "all"
  },
  {
   "x": 5,
   "y": 10,
   "z": 0,
   "dof": "all"
  },
  {
   "x": 5,
   "y": 10,
   "z": 1,
   "dof": "all"
  },
  {
   "x": 5,
   "y": 10,
   "z": 2,
   "dof": "all"
  },
  {
   "x": 5,
   "y": 10,
   "z": 3,
   "dof": "all"
  },
  {
   "x": 5,
   "y": 10,
   "z": 4,
   "dof": "all"
  },
  {
   "x": 5,
   "y": 10,
   "z": 5,
   "dof": "all"
  },
  {
   "x": 5,
   "y": 11,
   "z": 0,
   "dof": "all"
  },
  {
   "x": 5,
   "y": 11,
   "z": 1,
   "dof": "all"
  },
  {
   "x": 5,
   "y": 11,
   "z": 2,
   "dof": "all"
  },
  {
   "x": 5,
   "y": 11,
   "z": 3,
   "dof": "all"
  },
  {
   "x": 5,
   "y": 11,
   "z": 4,
   "dof": "all"
  },
  {
   "x": 5,
   "y": 11,
   "z": 5,
   "dof": "all"
  },
  {
   "x": 6,
   "y": 9,
   "z": 0,
   "dof": "all"
  },
  {
   "x": 6,
   "y": 9,
   "z": 1,
   "dof": "all"
  },
  {
   "x": 6,
   "y": 9,
   "z": 2,
   "dof": "all"
  },
  {
   "x": 6,
   "y": 9,
   "z": 3,
   "dof": "all"
  },
  {
   "x": 6,
   "y": 9,
   "z": 4,
   "dof": "all"
  },
  {
   "x": 6,
   "y": 9,
   "z": 5,
   "dof": "all"
  },
  {
   "x": 6,
   "y": 10,
   "z": 0,
   "dof": "all"
  },
  {
   "x": 6,
   "y": 10,
   "z": 1,
   "dof": "all"
  },
  {
   "x": 6,
   "y": 10,
   "z": 2,
   "dof": "all"
  },
  {
   "x": 6,
   "y": 10,
   "z": 3,
   "dof": "all"
  },
  {
   "x": 6,
   "y": 10,
   "z": 4,
   "dof": "all"
  },
  {
   "x": 6,
   "y": 10,
   "z": 5,
   "dof": "all"
  },
  {
   "x": 6,
   "y": 11,
   "z": 0,
   "dof": "all"
  },
  {
   "x": 6,
   "y": 11,
   "z": 1,
   "dof": "all"
  },
  {
   "x": 6,
   "y": 11,
   "z": 2,
   "dof": "all"
  },
  {
   "x": 6,
   "y": 11,
   "z": 3,
   "dof": "all"
  },
  {
   "x": 6,
   "y": 11,
   "z": 4,
   "dof": "all"
  },
  {
   "x": 6,
   "y": 11,
   "z": 5,
   "dof": "all"
  }
 ],
 "simp": {
  "p": 3.0,
  "rmin": 2.0
 },
 "preserve": [
  {
   "type": "box",
   "x0": 2,
   "y0": 7,
   "z0": 0,
   "x1": 8,
   "y1": 7,
   "z1": 4
  },
  {
   "type": "box",
   "x0": 2,
   "y0": 13,
   "z0": 0,
   "x1": 8,
   "y1": 13,
   "z1": 4
  },
  {
   "type": "box",
   "x0": 2,
   "y0": 8,
   "z0": 0,
   "x1": 2,
   "y1": 12,
   "z1": 4
  },
  {
   "type": "box",
   "x0": 8,
   "y0": 8,
   "z0": 0,
   "x1": 8,
   "y1": 12,
   "z1": 4
  },
  {
   "type": "box",
   "x0": 36,
   "y0": 0,
   "z0": 0,
   "x1": 39,
   "y1": 1,
   "z1": 4
  }
 ],
 "void": [
  {
   "type": "cylinder",
   "axis": "z",
   "cx": 5.0,
   "cy": 10.0,
   "r": 1.5,
   "z0": 0,
   "z1": 4
  }
 ],
 "_comment": "Ban doi chung DoD-2.1: CHI case chinh 1200N. Sinh boi gen_brake_pedal_spec.py.",
 "loads": [
  {
   "x": 36,
   "y": 0,
   "z": 0,
   "fy": 15.0
  },
  {
   "x": 36,
   "y": 0,
   "z": 1,
   "fy": 30.0
  },
  {
   "x": 36,
   "y": 0,
   "z": 2,
   "fy": 30.0
  },
  {
   "x": 36,
   "y": 0,
   "z": 3,
   "fy": 30.0
  },
  {
   "x": 36,
   "y": 0,
   "z": 4,
   "fy": 30.0
  },
  {
   "x": 36,
   "y": 0,
   "z": 5,
   "fy": 15.0
  },
  {
   "x": 37,
   "y": 0,
   "z": 0,
   "fy": 30.0
  },
  {
   "x": 37,
   "y": 0,
   "z": 1,
   "fy": 60.0
  },
  {
   "x": 37,
   "y": 0,
   "z": 2,
   "fy": 60.0
  },
  {
   "x": 37,
   "y": 0,
   "z": 3,
   "fy": 60.0
  },
  {
   "x": 37,
   "y": 0,
   "z": 4,
   "fy": 60.0
  },
  {
   "x": 37,
   "y": 0,
   "z": 5,
   "fy": 30.0
  },
  {
   "x": 38,
   "y": 0,
   "z": 0,
   "fy": 30.0
  },
  {
   "x": 38,
   "y": 0,
   "z": 1,
   "fy": 60.0
  },
  {
   "x": 38,
   "y": 0,
   "z": 2,
   "fy": 60.0
  },
  {
   "x": 38,
   "y": 0,
   "z": 3,
   "fy": 60.0
  },
  {
   "x": 38,
   "y": 0,
   "z": 4,
   "fy": 60.0
  },
  {
   "x": 38,
   "y": 0,
   "z": 5,
   "fy": 30.0
  },
  {
   "x": 39,
   "y": 0,
   "z": 0,
   "fy": 30.0
  },
  {
   "x": 39,
   "y": 0,
   "z": 1,
   "fy": 60.0
  },
  {
   "x": 39,
   "y": 0,
   "z": 2,
   "fy": 60.0
  },
  {
   "x": 39,
   "y": 0,
   "z": 3,
   "fy": 60.0
  },
  {
   "x": 39,
   "y": 0,
   "z": 4,
   "fy": 60.0
  },
  {
   "x": 39,
   "y": 0,
   "z": 5,
   "fy": 30.0
  },
  {
   "x": 40,
   "y": 0,
   "z": 0,
   "fy": 15.0
  },
  {
   "x": 40,
   "y": 0,
   "z": 1,
   "fy": 30.0
  },
  {
   "x": 40,
   "y": 0,
   "z": 2,
   "fy": 30.0
  },
  {
   "x": 40,
   "y": 0,
   "z": 3,
   "fy": 30.0
  },
  {
   "x": 40,
   "y": 0,
   "z": 4,
   "fy": 30.0
  },
  {
   "x": 40,
   "y": 0,
   "z": 5,
   "fy": 15.0
  }
 ]
}
