{
  "_comment": "Cantilever 3D benchmark top3d: ngàm mặt x0, lực -y phân bố dọc cạnh dưới mặt tự do x=60 (chuẩn hóa ở tầng 1.3)",
  "nelx": 60,
  "nely": 20,
  "nelz": 4,
  "volfrac": 0.3,
  "loads": [
    {"x": 60, "y": 20, "z": 0, "fx": 0.0, "fy": -0.125, "fz": 0.0},
    {"x": 60, "y": 20, "z": 1, "fx": 0.0, "fy": -0.25, "fz": 0.0},
    {"x": 60, "y": 20, "z": 2, "fx": 0.0, "fy": -0.25, "fz": 0.0},
    {"x": 60, "y": 20, "z": 3, "fx": 0.0, "fy": -0.25, "fz": 0.0},
    {"x": 60, "y": 20, "z": 4, "fx": 0.0, "fy": -0.125, "fz": 0.0}
  ],
  "supports": [{"face": "x0", "dof": "all"}],
  "material": {"E": 1.0, "nu": 0.3},
  "simp": {"p": 3.0, "rmin": 1.5},
  "preserve": [],
  "void": []
}
