{
 "_comment": "agent trial 2 — dam thep 2 goi 800N giua nhip",
 "nelx": 32,
 "nely": 12,
 "nelz": 4,
 "volfrac": 0.35,
 "element_size_mm": 4.0,
 "material_name": "thep_s235",
 "loads": [
  {
   "x": 16,
   "y": 0,
   "z": 0,
   "fy": 160.0
  },
  {
   "x": 16,
   "y": 0,
   "z": 1,
   "fy": 160.0
  },
  {
   "x": 16,
   "y": 0,
   "z": 2,
   "fy": 160.0
  },
  {
   "x": 16,
   "y": 0,
   "z": 3,
   "fy": 160.0
  },
  {
   "x": 16,
   "y": 0,
   "z": 4,
   "fy": 160.0
  }
 ],
 "supports": [
  {
   "x": 0,
   "y": 12,
   "z": 0,
   "dof": "all"
  },
  {
   "x": 0,
   "y": 12,
   "z": 1,
   "dof": "all"
  },
  {
   "x": 0,
   "y": 12,
   "z": 2,
   "dof": "all"
  },
  {
   "x": 0,
   "y": 12,
   "z": 3,
   "dof": "all"
  },
  {
   "x": 0,
   "y": 12,
   "z": 4,
   "dof": "all"
  },
  {
   "x": 32,
   "y": 12,
   "z": 0,
   "dof": "all"
  },
  {
   "x": 32,
   "y": 12,
   "z": 1,
   "dof": "all"
  },
  {
   "x": 32,
   "y": 12,
   "z": 2,
   "dof": "all"
  },
  {
   "x": 32,
   "y": 12,
   "z": 3,
   "dof": "all"
  },
  {
   "x": 32,
   "y": 12,
   "z": 4,
   "dof": "all"
  }
 ],
 "simp": {
  "p": 3.0,
  "rmin": 1.5
 },
 "preserve": [],
 "void": []
}