{
 "_comment": "gauntlet 04 — cat ngang fz mien det",
 "nelx": 24,
 "nely": 16,
 "nelz": 2,
 "volfrac": 0.4,
 "element_size_mm": 4.0,
 "material_name": "nhom_6061_t6",
 "loads": [
  {
   "x": 24,
   "y": 0,
   "z": 1,
   "fz": 11.764705882352942
  },
  {
   "x": 24,
   "y": 1,
   "z": 1,
   "fz": 11.764705882352942
  },
  {
   "x": 24,
   "y": 2,
   "z": 1,
   "fz": 11.764705882352942
  },
  {
   "x": 24,
   "y": 3,
   "z": 1,
   "fz": 11.764705882352942
  },
  {
   "x": 24,
   "y": 4,
   "z": 1,
   "fz": 11.764705882352942
  },
  {
   "x": 24,
   "y": 5,
   "z": 1,
   "fz": 11.764705882352942
  },
  {
   "x": 24,
   "y": 6,
   "z": 1,
   "fz": 11.764705882352942
  },
  {
   "x": 24,
   "y": 7,
   "z": 1,
   "fz": 11.764705882352942
  },
  {
   "x": 24,
   "y": 8,
   "z": 1,
   "fz": 11.764705882352942
  },
  {
   "x": 24,
   "y": 9,
   "z": 1,
   "fz": 11.764705882352942
  },
  {
   "x": 24,
   "y": 10,
   "z": 1,
   "fz": 11.764705882352942
  },
  {
   "x": 24,
   "y": 11,
   "z": 1,
   "fz": 11.764705882352942
  },
  {
   "x": 24,
   "y": 12,
   "z": 1,
   "fz": 11.764705882352942
  },
  {
   "x": 24,
   "y": 13,
   "z": 1,
   "fz": 11.764705882352942
  },
  {
   "x": 24,
   "y": 14,
   "z": 1,
   "fz": 11.764705882352942
  },
  {
   "x": 24,
   "y": 15,
   "z": 1,
   "fz": 11.764705882352942
  },
  {
   "x": 24,
   "y": 16,
   "z": 1,
   "fz": 11.764705882352942
  }
 ],
 "supports": [
  {
   "face": "x0",
   "dof": "all"
  }
 ],
 "simp": {
  "p": 3.0,
  "rmin": 1.5
 },
 "preserve": [],
 "void": []
}