{
 "_comment": "agent trial 3 — tam treo titan 2 lo bu-long, 2 case",
 "nelx": 20,
 "nely": 10,
 "nelz": 3,
 "volfrac": 0.45,
 "element_size_mm": 4.0,
 "material_name": "ti_6al_4v",
 "load_cases": [
  {
   "weight": 1.0,
   "loads": [
    {
     "x": 10,
     "y": 10,
     "z": 0,
     "fy": 75.0
    },
    {
     "x": 10,
     "y": 10,
     "z": 1,
     "fy": 75.0
    },
    {
     "x": 10,
     "y": 10,
     "z": 2,
     "fy": 75.0
    },
    {
     "x": 10,
     "y": 10,
     "z": 3,
     "fy": 75.0
    }
   ]
  },
  {
   "weight": 0.3,
   "loads": [
    {
     "x": 10,
     "y": 10,
     "z": 0,
     "fz": 22.5
    },
    {
     "x": 10,
     "y": 10,
     "z": 1,
     "fz": 22.5
    },
    {
     "x": 10,
     "y": 10,
     "z": 2,
     "fz": 22.5
    },
    {
     "x": 10,
     "y": 10,
     "z": 3,
     "fz": 22.5
    }
   ]
  }
 ],
 "supports": [
  {
   "x": 3,
   "y": 1,
   "z": 0,
   "dof": "all"
  },
  {
   "x": 3,
   "y": 1,
   "z": 1,
   "dof": "all"
  },
  {
   "x": 3,
   "y": 1,
   "z": 2,
   "dof": "all"
  },
  {
   "x": 3,
   "y": 1,
   "z": 3,
   "dof": "all"
  },
  {
   "x": 3,
   "y": 2,
   "z": 0,
   "dof": "all"
  },
  {
   "x": 3,
   "y": 2,
   "z": 1,
   "dof": "all"
  },
  {
   "x": 3,
   "y": 2,
   "z": 2,
   "dof": "all"
  },
  {
   "x": 3,
   "y": 2,
   "z": 3,
   "dof": "all"
  },
  {
   "x": 3,
   "y": 3,
   "z": 0,
   "dof": "all"
  },
  {
   "x": 3,
   "y": 3,
   "z": 1,
   "dof": "all"
  },
  {
   "x": 3,
   "y": 3,
   "z": 2,
   "dof": "all"
  },
  {
   "x": 3,
   "y": 3,
   "z": 3,
   "dof": "all"
  },
  {
   "x": 4,
   "y": 1,
   "z": 0,
   "dof": "all"
  },
  {
   "x": 4,
   "y": 1,
   "z": 1,
   "dof": "all"
  },
  {
   "x": 4,
   "y": 1,
   "z": 2,
   "dof": "all"
  },
  {
   "x": 4,
   "y": 1,
   "z": 3,
   "dof": "all"
  },
  {
   "x": 4,
   "y": 2,
   "z": 0,
   "dof": "all"
  },
  {
   "x": 4,
   "y": 2,
   "z": 1,
   "dof": "all"
  },
  {
   "x": 4,
   "y": 2,
   "z": 2,
   "dof": "all"
  },
  {
   "x": 4,
   "y": 2,
   "z": 3,
   "dof": "all"
  },
  {
   "x": 4,
   "y": 3,
   "z": 0,
   "dof": "all"
  },
  {
   "x": 4,
   "y": 3,
   "z": 1,
   "dof": "all"
  },
  {
   "x": 4,
   "y": 3,
   "z": 2,
   "dof": "all"
  },
  {
   "x": 4,
   "y": 3,
   "z": 3,
   "dof": "all"
  },
  {
   "x": 5,
   "y": 1,
   "z": 0,
   "dof": "all"
  },
  {
   "x": 5,
   "y": 1,
   "z": 1,
   "dof": "all"
  },
  {
   "x": 5,
   "y": 1,
   "z": 2,
   "dof": "all"
  },
  {
   "x": 5,
   "y": 1,
   "z": 3,
   "dof": "all"
  },
  {
   "x": 5,
   "y": 2,
   "z": 0,
   "dof": "all"
  },
  {
   "x": 5,
   "y": 2,
   "z": 1,
   "dof": "all"
  },
  {
   "x": 5,
   "y": 2,
   "z": 2,
   "dof": "all"
  },
  {
   "x": 5,
   "y": 2,
   "z": 3,
   "dof": "all"
  },
  {
   "x": 5,
   "y": 3,
   "z": 0,
   "dof": "all"
  },
  {
   "x": 5,
   "y": 3,
   "z": 1,
   "dof": "all"
  },
  {
   "x": 5,
   "y": 3,
   "z": 2,
   "dof": "all"
  },
  {
   "x": 5,
   "y": 3,
   "z": 3,
   "dof": "all"
  },
  {
   "x": 15,
   "y": 1,
   "z": 0,
   "dof": "all"
  },
  {
   "x": 15,
   "y": 1,
   "z": 1,
   "dof": "all"
  },
  {
   "x": 15,
   "y": 1,
   "z": 2,
   "dof": "all"
  },
  {
   "x": 15,
   "y": 1,
   "z": 3,
   "dof": "all"
  },
  {
   "x": 15,
   "y": 2,
   "z": 0,
   "dof": "all"
  },
  {
   "x": 15,
   "y": 2,
   "z": 1,
   "dof": "all"
  },
  {
   "x": 15,
   "y": 2,
   "z": 2,
   "dof": "all"
  },
  {
   "x": 15,
   "y": 2,
   "z": 3,
   "dof": "all"
  },
  {
   "x": 15,
   "y": 3,
   "z": 0,
   "dof": "all"
  },
  {
   "x": 15,
   "y": 3,
   "z": 1,
   "dof": "all"
  },
  {
   "x": 15,
   "y": 3,
   "z": 2,
   "dof": "all"
  },
  {
   "x": 15,
   "y": 3,
   "z": 3,
   "dof": "all"
  },
  {
   "x": 16,
   "y": 1,
   "z": 0,
   "dof": "all"
  },
  {
   "x": 16,
   "y": 1,
   "z": 1,
   "dof": "all"
  },
  {
   "x": 16,
   "y": 1,
   "z": 2,
   "dof": "all"
  },
  {
   "x": 16,
   "y": 1,
   "z": 3,
   "dof": "all"
  },
  {
   "x": 16,
   "y": 2,
   "z": 0,
   "dof": "all"
  },
  {
   "x": 16,
   "y": 2,
   "z": 1,
   "dof": "all"
  },
  {
   "x": 16,
   "y": 2,
   "z": 2,
   "dof": "all"
  },
  {
   "x": 16,
   "y": 2,
   "z": 3,
   "dof": "all"
  },
  {
   "x": 16,
   "y": 3,
   "z": 0,
   "dof": "all"
  },
  {
   "x": 16,
   "y": 3,
   "z": 1,
   "dof": "all"
  },
  {
   "x": 16,
   "y": 3,
   "z": 2,
   "dof": "all"
  },
  {
   "x": 16,
   "y": 3,
   "z": 3,
   "dof": "all"
  },
  {
   "x": 17,
   "y": 1,
   "z": 0,
   "dof": "all"
  },
  {
   "x": 17,
   "y": 1,
   "z": 1,
   "dof": "all"
  },
  {
   "x": 17,
   "y": 1,
   "z": 2,
   "dof": "all"
  },
  {
   "x": 17,
   "y": 1,
   "z": 3,
   "dof": "all"
  },
  {
   "x": 17,
   "y": 2,
   "z": 0,
   "dof": "all"
  },
  {
   "x": 17,
   "y": 2,
   "z": 1,
   "dof": "all"
  },
  {
   "x": 17,
   "y": 2,
   "z": 2,
   "dof": "all"
  },
  {
   "x": 17,
   "y": 2,
   "z": 3,
   "dof": "all"
  },
  {
   "x": 17,
   "y": 3,
   "z": 0,
   "dof": "all"
  },
  {
   "x": 17,
   "y": 3,
   "z": 1,
   "dof": "all"
  },
  {
   "x": 17,
   "y": 3,
   "z": 2,
   "dof": "all"
  },
  {
   "x": 17,
   "y": 3,
   "z": 3,
   "dof": "all"
  }
 ],
 "simp": {
  "p": 3.0,
  "rmin": 1.5
 },
 "preserve": [
  {
   "type": "box",
   "x0": 2,
   "y0": 0,
   "z0": 0,
   "x1": 6,
   "y1": 0,
   "z1": 2
  },
  {
   "type": "box",
   "x0": 2,
   "y0": 4,
   "z0": 0,
   "x1": 6,
   "y1": 4,
   "z1": 2
  },
  {
   "type": "box",
   "x0": 2,
   "y0": 1,
   "z0": 0,
   "x1": 2,
   "y1": 3,
   "z1": 2
  },
  {
   "type": "box",
   "x0": 6,
   "y0": 1,
   "z0": 0,
   "x1": 6,
   "y1": 3,
   "z1": 2
  },
  {
   "type": "box",
   "x0": 14,
   "y0": 0,
   "z0": 0,
   "x1": 18,
   "y1": 0,
   "z1": 2
  },
  {
   "type": "box",
   "x0": 14,
   "y0": 4,
   "z0": 0,
   "x1": 18,
   "y1": 4,
   "z1": 2
  },
  {
   "type": "box",
   "x0": 14,
   "y0": 1,
   "z0": 0,
   "x1": 14,
   "y1": 3,
   "z1": 2
  },
  {
   "type": "box",
   "x0": 18,
   "y0": 1,
   "z0": 0,
   "x1": 18,
   "y1": 3,
   "z1": 2
  }
 ],
 "void": [
  {
   "type": "cylinder",
   "axis": "z",
   "cx": 4.0,
   "cy": 2.0,
   "r": 1.0,
   "z0": 0,
   "z1": 2
  },
  {
   "type": "cylinder",
   "axis": "z",
   "cx": 16.0,
   "cy": 2.0,
   "r": 1.0,
   "z0": 0,
   "z1": 2
  }
 ]
}