{
 "_comment": "gauntlet 06 — 3 case x/y/z",
 "nelx": 16,
 "nely": 8,
 "nelz": 8,
 "volfrac": 0.4,
 "element_size_mm": 4.0,
 "material_name": "nhom_6061_t6",
 "load_cases": [
  {
   "weight": 1.0,
   "loads": [
    {
     "x": 16,
     "y": 0,
     "z": 0,
     "fy": 33.333333333333336
    },
    {
     "x": 16,
     "y": 0,
     "z": 1,
     "fy": 33.333333333333336
    },
    {
     "x": 16,
     "y": 0,
     "z": 2,
     "fy": 33.333333333333336
    },
    {
     "x": 16,
     "y": 0,
     "z": 3,
     "fy": 33.333333333333336
    },
    {
     "x": 16,
     "y": 0,
     "z": 4,
     "fy": 33.333333333333336
    },
    {
     "x": 16,
     "y": 0,
     "z": 5,
     "fy": 33.333333333333336
    },
    {
     "x": 16,
     "y": 0,
     "z": 6,
     "fy": 33.333333333333336
    },
    {
     "x": 16,
     "y": 0,
     "z": 7,
     "fy": 33.333333333333336
    },
    {
     "x": 16,
     "y": 0,
     "z": 8,
     "fy": 33.333333333333336
    }
   ]
  },
  {
   "weight": 0.5,
   "loads": [
    {
     "x": 16,
     "y": 0,
     "z": 0,
     "fx": -16.666666666666668
    },
    {
     "x": 16,
     "y": 0,
     "z": 1,
     "fx": -16.666666666666668
    },
    {
     "x": 16,
     "y": 0,
     "z": 2,
     "fx": -16.666666666666668
    },
    {
     "x": 16,
     "y": 0,
     "z": 3,
     "fx": -16.666666666666668
    },
    {
     "x": 16,
     "y": 0,
     "z": 4,
     "fx": -16.666666666666668
    },
    {
     "x": 16,
     "y": 0,
     "z": 5,
     "fx": -16.666666666666668
    },
    {
     "x": 16,
     "y": 0,
     "z": 6,
     "fx": -16.666666666666668
    },
    {
     "x": 16,
     "y": 0,
     "z": 7,
     "fx": -16.666666666666668
    },
    {
     "x": 16,
     "y": 0,
     "z": 8,
     "fx": -16.666666666666668
    }
   ]
  },
  {
   "weight": 0.3,
   "loads": [
    {
     "x": 16,
     "y": 0,
     "z": 0,
     "fz": 10.0
    },
    {
     "x": 16,
     "y": 0,
     "z": 1,
     "fz": 10.0
    },
    {
     "x": 16,
     "y": 0,
     "z": 2,
     "fz": 10.0
    },
    {
     "x": 16,
     "y": 0,
     "z": 3,
     "fz": 10.0
    },
    {
     "x": 16,
     "y": 0,
     "z": 4,
     "fz": 10.0
    },
    {
     "x": 16,
     "y": 0,
     "z": 5,
     "fz": 10.0
    },
    {
     "x": 16,
     "y": 0,
     "z": 6,
     "fz": 10.0
    },
    {
     "x": 16,
     "y": 0,
     "z": 7,
     "fz": 10.0
    },
    {
     "x": 16,
     "y": 0,
     "z": 8,
     "fz": 10.0
    }
   ]
  }
 ],
 "supports": [
  {
   "face": "x0",
   "dof": "all"
  }
 ],
 "simp": {
  "p": 3.0,
  "rmin": 1.5
 },
 "preserve": [],
 "void": []
}