{
 "_comment": "gauntlet 05 — L-bracket void cat mien + bu-long",
 "nelx": 16,
 "nely": 16,
 "nelz": 4,
 "volfrac": 0.45,
 "element_size_mm": 4.0,
 "material_name": "thep_s235",
 "loads": [
  {
   "x": 16,
   "y": 7,
   "z": 0,
   "fy": 80.0
  },
  {
   "x": 16,
   "y": 7,
   "z": 1,
   "fy": 80.0
  },
  {
   "x": 16,
   "y": 7,
   "z": 2,
   "fy": 80.0
  },
  {
   "x": 16,
   "y": 7,
   "z": 3,
   "fy": 80.0
  },
  {
   "x": 16,
   "y": 7,
   "z": 4,
   "fy": 80.0
  }
 ],
 "supports": [
  {
   "x": 3,
   "y": 11,
   "z": 0,
   "dof": "all"
  },
  {
   "x": 3,
   "y": 11,
   "z": 1,
   "dof": "all"
  },
  {
   "x": 3,
   "y": 11,
   "z": 2,
   "dof": "all"
  },
  {
   "x": 3,
   "y": 11,
   "z": 3,
   "dof": "all"
  },
  {
   "x": 3,
   "y": 11,
   "z": 4,
   "dof": "all"
  },
  {
   "x": 3,
   "y": 12,
   "z": 0,
   "dof": "all"
  },
  {
   "x": 3,
   "y": 12,
   "z": 1,
   "dof": "all"
  },
  {
   "x": 3,
   "y": 12,
   "z": 2,
   "dof": "all"
  },
  {
   "x": 3,
   "y": 12,
   "z": 3,
   "dof": "all"
  },
  {
   "x": 3,
   "y": 12,
   "z": 4,
   "dof": "all"
  },
  {
   "x": 3,
   "y": 13,
   "z": 0,
   "dof": "all"
  },
  {
   "x": 3,
   "y": 13,
   "z": 1,
   "dof": "all"
  },
  {
   "x": 3,
   "y": 13,
   "z": 2,
   "dof": "all"
  },
  {
   "x": 3,
   "y": 13,
   "z": 3,
   "dof": "all"
  },
  {
   "x": 3,
   "y": 13,
   "z": 4,
   "dof": "all"
  },
  {
   "x": 4,
   "y": 11,
   "z": 0,
   "dof": "all"
  },
  {
   "x": 4,
   "y": 11,
   "z": 1,
   "dof": "all"
  },
  {
   "x": 4,
   "y": 11,
   "z": 2,
   "dof": "all"
  },
  {
   "x": 4,
   "y": 11,
   "z": 3,
   "dof": "all"
  },
  {
   "x": 4,
   "y": 11,
   "z": 4,
   "dof": "all"
  },
  {
   "x": 4,
   "y": 12,
   "z": 0,
   "dof": "all"
  },
  {
   "x": 4,
   "y": 12,
   "z": 1,
   "dof": "all"
  },
  {
   "x": 4,
   "y": 12,
   "z": 2,
   "dof": "all"
  },
  {
   "x": 4,
   "y": 12,
   "z": 3,
   "dof": "all"
  },
  {
   "x": 4,
   "y": 12,
   "z": 4,
   "dof": "all"
  },
  {
   "x": 4,
   "y": 13,
   "z": 0,
   "dof": "all"
  },
  {
   "x": 4,
   "y": 13,
   "z": 1,
   "dof": "all"
  },
  {
   "x": 4,
   "y": 13,
   "z": 2,
   "dof": "all"
  },
  {
   "x": 4,
   "y": 13,
   "z": 3,
   "dof": "all"
  },
  {
   "x": 4,
   "y": 13,
   "z": 4,
   "dof": "all"
  },
  {
   "x": 5,
   "y": 11,
   "z": 0,
   "dof": "all"
  },
  {
   "x": 5,
   "y": 11,
   "z": 1,
   "dof": "all"
  },
  {
   "x": 5,
   "y": 11,
   "z": 2,
   "dof": "all"
  },
  {
   "x": 5,
   "y": 11,
   "z": 3,
   "dof": "all"
  },
  {
   "x": 5,
   "y": 11,
   "z": 4,
   "dof": "all"
  },
  {
   "x": 5,
   "y": 12,
   "z": 0,
   "dof": "all"
  },
  {
   "x": 5,
   "y": 12,
   "z": 1,
   "dof": "all"
  },
  {
   "x": 5,
   "y": 12,
   "z": 2,
   "dof": "all"
  },
  {
   "x": 5,
   "y": 12,
   "z": 3,
   "dof": "all"
  },
  {
   "x": 5,
   "y": 12,
   "z": 4,
   "dof": "all"
  },
  {
   "x": 5,
   "y": 13,
   "z": 0,
   "dof": "all"
  },
  {
   "x": 5,
   "y": 13,
   "z": 1,
   "dof": "all"
  },
  {
   "x": 5,
   "y": 13,
   "z": 2,
   "dof": "all"
  },
  {
   "x": 5,
   "y": 13,
   "z": 3,
   "dof": "all"
  },
  {
   "x": 5,
   "y": 13,
   "z": 4,
   "dof": "all"
  }
 ],
 "simp": {
  "p": 3.0,
  "rmin": 1.5
 },
 "preserve": [
  {
   "type": "box",
   "x0": 2,
   "y0": 9,
   "z0": 0,
   "x1": 6,
   "y1": 10,
   "z1": 3
  },
  {
   "type": "box",
   "x0": 2,
   "y0": 14,
   "z0": 0,
   "x1": 6,
   "y1": 15,
   "z1": 3
  },
  {
   "type": "box",
   "x0": 2,
   "y0": 11,
   "z0": 0,
   "x1": 2,
   "y1": 13,
   "z1": 3
  },
  {
   "type": "box",
   "x0": 6,
   "y0": 11,
   "z0": 0,
   "x1": 6,
   "y1": 13,
   "z1": 3
  }
 ],
 "void": [
  {
   "type": "box",
   "x0": 8,
   "y0": 8,
   "z0": 0,
   "x1": 15,
   "y1": 15,
   "z1": 3
  },
  {
   "type": "cylinder",
   "axis": "z",
   "cx": 4.0,
   "cy": 12.0,
   "r": 1.0,
   "z0": 0,
   "z1": 3
  }
 ]
}