{
 "_comment": "gauntlet 07 — volfrac 0.20 khan",
 "nelx": 24,
 "nely": 12,
 "nelz": 4,
 "volfrac": 0.2,
 "element_size_mm": 4.0,
 "material_name": "ti_6al_4v",
 "loads": [
  {
   "x": 24,
   "y": 0,
   "z": 0,
   "fy": 70.0
  },
  {
   "x": 24,
   "y": 0,
   "z": 1,
   "fy": 70.0
  },
  {
   "x": 24,
   "y": 0,
   "z": 2,
   "fy": 70.0
  },
  {
   "x": 24,
   "y": 0,
   "z": 3,
   "fy": 70.0
  },
  {
   "x": 24,
   "y": 0,
   "z": 4,
   "fy": 70.0
  }
 ],
 "supports": [
  {
   "face": "x0",
   "dof": "all"
  }
 ],
 "simp": {
  "p": 3.0,
  "rmin": 1.5
 },
 "preserve": [],
 "void": []
}