{
 "_comment": "gauntlet 06 — ban single doi chung",
 "nelx": 16,
 "nely": 8,
 "nelz": 8,
 "volfrac": 0.4,
 "element_size_mm": 4.0,
 "material_name": "nhom_6061_t6",
 "supports": [
  {
   "face": "x0",
   "dof": "all"
  }
 ],
 "simp": {
  "p": 3.0,
  "rmin": 1.5
 },
 "preserve": [],
 "void": [],
 "loads": [
  {
   "x": 16,
   "y": 0,
   "z": 0,
   "fy": 33.333333333333336
  },
  {
   "x": 16,
   "y": 0,
   "z": 1,
   "fy": 33.333333333333336
  },
  {
   "x": 16,
   "y": 0,
   "z": 2,
   "fy": 33.333333333333336
  },
  {
   "x": 16,
   "y": 0,
   "z": 3,
   "fy": 33.333333333333336
  },
  {
   "x": 16,
   "y": 0,
   "z": 4,
   "fy": 33.333333333333336
  },
  {
   "x": 16,
   "y": 0,
   "z": 5,
   "fy": 33.333333333333336
  },
  {
   "x": 16,
   "y": 0,
   "z": 6,
   "fy": 33.333333333333336
  },
  {
   "x": 16,
   "y": 0,
   "z": 7,
   "fy": 33.333333333333336
  },
  {
   "x": 16,
   "y": 0,
   "z": 8,
   "fy": 33.333333333333336
  }
 ]
}