{
 "_comment": "agent trial 1 — cong-xon nhom 500N",
 "nelx": 24,
 "nely": 12,
 "nelz": 6,
 "volfrac": 0.4,
 "element_size_mm": 4.0,
 "material_name": "nhom_6061_t6",
 "loads": [
  {
   "x": 24,
   "y": 0,
   "z": 0,
   "fy": 71.428571
  },
  {
   "x": 24,
   "y": 0,
   "z": 1,
   "fy": 71.428571
  },
  {
   "x": 24,
   "y": 0,
   "z": 2,
   "fy": 71.428571
  },
  {
   "x": 24,
   "y": 0,
   "z": 3,
   "fy": 71.428571
  },
  {
   "x": 24,
   "y": 0,
   "z": 4,
   "fy": 71.428571
  },
  {
   "x": 24,
   "y": 0,
   "z": 5,
   "fy": 71.428571
  },
  {
   "x": 24,
   "y": 0,
   "z": 6,
   "fy": 71.428571
  }
 ],
 "supports": [
  {
   "face": "x0",
   "dof": "all"
  }
 ],
 "simp": {
  "p": 3.0,
  "rmin": 1.5
 },
 "preserve": [],
 "void": []
}