{
 "_comment": "gauntlet 02 — tai 1/4 nhip, ky vong don ve goi trai",
 "nelx": 32,
 "nely": 10,
 "nelz": 4,
 "volfrac": 0.35,
 "element_size_mm": 4.0,
 "material_name": "thep_s235",
 "loads": [
  {
   "x": 8,
   "y": 0,
   "z": 0,
   "fy": 120.0
  },
  {
   "x": 8,
   "y": 0,
   "z": 1,
   "fy": 120.0
  },
  {
   "x": 8,
   "y": 0,
   "z": 2,
   "fy": 120.0
  },
  {
   "x": 8,
   "y": 0,
   "z": 3,
   "fy": 120.0
  },
  {
   "x": 8,
   "y": 0,
   "z": 4,
   "fy": 120.0
  }
 ],
 "supports": [
  {
   "x": 0,
   "y": 10,
   "z": 0,
   "dof": "all"
  },
  {
   "x": 0,
   "y": 10,
   "z": 1,
   "dof": "all"
  },
  {
   "x": 0,
   "y": 10,
   "z": 2,
   "dof": "all"
  },
  {
   "x": 0,
   "y": 10,
   "z": 3,
   "dof": "all"
  },
  {
   "x": 0,
   "y": 10,
   "z": 4,
   "dof": "all"
  },
  {
   "x": 32,
   "y": 10,
   "z": 0,
   "dof": "all"
  },
  {
   "x": 32,
   "y": 10,
   "z": 1,
   "dof": "all"
  },
  {
   "x": 32,
   "y": 10,
   "z": 2,
   "dof": "all"
  },
  {
   "x": 32,
   "y": 10,
   "z": 3,
   "dof": "all"
  },
  {
   "x": 32,
   "y": 10,
   "z": 4,
   "dof": "all"
  }
 ],
 "simp": {
  "p": 3.0,
  "rmin": 1.5
 },
 "preserve": [],
 "void": []
}